<?xml version="1.0" encoding="utf-8"?>
<!-- Hotels.xml - an instance of Hotels.xsd -->
<Hotels xmlns:xsi="http://www.w3.org/2001/XMLSchema-instance"
        xsi:noNamespaceSchemaLocation="Hotels.xsd">

  <Hotel id="H0001" notes="assignment-sample">
    <Name>Westin</Name>
    <Phone>480-968-8885</Phone>
    <Phone>800-937-8461</Phone>
    <Address NearestAirport="Sky Harbor">
      <Number>11</Number>
      <Street>E.7th St</Street>
      <City>Tempe</City>
      <State>AZ</State>
      <Zip>85281</Zip>
    </Address>
    <Rating>4.2</Rating>
  </Hotel>

  <Hotel id="H0002">
    <Name>Hilton Garden Inn Phoenix</Name>
    <Phone>602-272-6888</Phone>
    <Address NearestAirport="Sky Harbor">
      <Number>2045</Number>
      <Street>East Indian School Rd</Street>
      <City>Phoenix</City>
      <State>AZ</State>
      <Zip>85016</Zip>
    </Address>
    <Rating>4.0</Rating>
  </Hotel>

  <Hotel id="H0003" notes="has two phones">
    <Name>Embassy Suites Phoenix</Name>
    <Phone>602-553-9999</Phone>
    <Phone>602-553-7777</Phone>
    <Address NearestAirport="Sky Harbor">
      <Number>4415</Number>
      <Street>East Washington St</Street>
      <City>Phoenix</City>
      <State>AZ</State>
      <Zip>85034</Zip>
    </Address>
  </Hotel>

  <Hotel id="H0004">
    <Name>Omni Scottsdale Resort</Name>
    <Phone>480-948-2100</Phone>
    <Address NearestAirport="Sky Harbor">
      <Number>7000</Number>
      <Street>East Camelback Rd</Street>
      <City>Scottsdale</City>
      <State>AZ</State>
      <Zip>85251</Zip>
    </Address>
    <Rating>4.3</Rating>
  </Hotel>

  <Hotel id="H0005">
    <Name>Arizona Grand Resort</Name>
    <Phone>480-789-5300</Phone>
    <Address NearestAirport="Sky Harbor">
      <Number>8000</Number>
      <Street>South Arizona Grand Pkwy</Street>
      <City>Phoenix</City>
      <State>AZ</State>
      <Zip>85044</Zip>
    </Address>
  </Hotel>  <Hotel id="H0006">
    <Name>JW Marriott Phoenix</Name>
    <Phone>602-222-3800</Phone>
    <Address NearestAirport="Sky Harbor">
      <Number>5350</Number>
      <Street>East Marriott Dr</Street>
      <City>Scottsdale</City>
      <State>AZ</State>
      <Zip>85258</Zip>
    </Address>
    <Rating>4.5</Rating>
  </Hotel>

  <Hotel id="H0007">
    <Name>Hyatt Regency Scottsdale</Name>
    <Phone>480-444-1234</Phone>
    <Address NearestAirport="Sky Harbor">
      <Number>7500</Number>
      <Street>East Doubletree Ranch Rd</Street>
      <City>Scottsdale</City>
      <State>AZ</State>
      <Zip>85258</Zip>
    </Address>
  </Hotel>

  <Hotel id="H0008">
    <Name>Fairmont Scottsdale Princess</Name>
    <Phone>480-585-4848</Phone>
    <Address NearestAirport="Sky Harbor">
      <Number>7575</Number>
      <Street>East Princess Dr</Street>
      <City>Scottsdale</City>
      <State>AZ</State>
      <Zip>85255</Zip>
    </Address>
    <Rating>4.6</Rating>
  </Hotel>

  <Hotel id="H0009">
    <Name>La Quinta Inn Phoenix</Name>
    <Phone>602-307-9999</Phone>
    <Address NearestAirport="Sky Harbor">
      <Number>1600</Number>
      <Street>East Bell Rd</Street>
      <City>Phoenix</City>
      <State>AZ</State>
      <Zip>85022</Zip>
    </Address>
  </Hotel>

  <Hotel id="H0010">
    <Name>Residence Inn Phoenix</Name>
    <Phone>602-957-5555</Phone>
    <Address NearestAirport="Sky Harbor">
      <Number>111</Number>
      <Street>North 2nd St</Street>
      <City>Phoenix</City>
      <State>AZ</State>
      <Zip>85004</Zip>
    </Address>
  </Hotel>

  <Hotel id="H0011">
    <Name>Courtyard Tempe</Name>
    <Phone>480-350-6000</Phone>
    <Address NearestAirport="Sky Harbor">
      <Number>100</Number>
      <Street>East 5th St</Street>
      <City>Tempe</City>
      <State>AZ</State>
      <Zip>85281</Zip>
    </Address>
    <Rating>3.9</Rating>
  </Hotel>

</Hotels>